{
    "$schema": "../footer.schema.json",
    "article-1": "Connect with us",
    "article-2": {
        "head": "Get to know us",
        "link-1": "Who we are",
        "link-2": "What we do",
        "link-3": "News"
    },
    "article-3": {
        "head": "Connect",
        "link-1": "FAQ",
        "link-2": "Pressroom",
        "link-3": "Visit the Ellen Campus"
    },
    "article-4": {
        "head": "Ways to give",
        "link-1": "Donate",
        "link-2": "Adopt a gorilla",
        "link-3": "Shop"
    },
    "copyright": "Â© 2023 Dian Fossey Gorilla Fund Inc. All right reserved",
    "donor-policy": "DONOR POLICY",
    "policy": "PRIVACY",
    "terms": "TERMS & CONDITIONS"
}
